profile,authority,authority_vocab,used_in_profile,controlled_field_ct,controlled_fields
core_10-0-0,place,place/local,y,23,"Chronology: Alternative date spatial coverage (Alternative Date Information)
Chronology: Associated place (Associated Authorities)
Chronology: Spatial coverage (Chronology Information)
Citation: Publication place (Citation Information)
Exhibition: Venue name (Exhibition Information)
Intake: Current location (Location Information)
Intake: Normal location (Location Information)
NAGPRA Inventory: Place represented name (Context)
Object: Field collection place (Object Collection Information)
Person: Associated place (Associated Authorities)
Person: Birth place supplied (Maker-Supplied Identity Information)
Place: Address country (Place Information)
Place: Address municipality (Place Information)
Place: Address state/province (Place Information)
Place: Associated place (Associated Authorities)
Repatriation Request: Place represented name (Repatriation Request Context)
Summary Documentation: Place represented name (Context)
Transport: Arrival point (Transport Information>Arrival)
Transport: Departure point (Transport Information>Departure)
Use of Collections: Location (Use of Collections Information)
Work: Address country (Work Information)
Work: Address municipality (Work Information)
Work: Address state/province (Work Information)"
core_10-0-0,place,place/tgn,y,14,"Chronology: Alternative date spatial coverage (Alternative Date Information)
Chronology: Associated place (Associated Authorities)
Chronology: Spatial coverage (Chronology Information)
Citation: Publication place (Citation Information)
Exhibition: Venue name (Exhibition Information)
Object: Field collection place (Object Collection Information)
Person: Associated place (Associated Authorities)
Place: Address country (Place Information)
Place: Address municipality (Place Information)
Place: Address state/province (Place Information)
Place: Associated place (Associated Authorities)
Work: Address country (Work Information)
Work: Address municipality (Work Information)
Work: Address state/province (Work Information)"
core_10-0-0,work,work/cona,n,0,""
core_10-0-0,work,work/local,y,1,Object: Named collection (Object Identification Information)
